Duolingo,https://www.duolingo.com/,,"S1 - Fear,S4 - Mastery,S3 - Trying",,,Corporation,,"Media,Product,Web Service",Language learning app,Education,#ERROR!,Duolingo is the most popular language-learning platform and the most downloaded education app in the world. The app is designed to feel like a game is scientifically proven to be effective,"The company's mission is to make education free, fun, and accessible to all.",,International	,200+ employees
Spelling Stage,https://apps.apple.com/us/app/spelling-stage/id1277968058,,"S1 - Fear,S4 - Mastery,S3 - Trying",,,Corporation,,Web Service,Spelling game app - highly recommended for ESL students ,Education,#ERROR!,The app has a customizable option and spelling games that can include up to 4+ users,Improve spelling skills and enhance vocabulary,,International,
Molecularium,https://www.molecularium.com/,,S3 - Trying,,,Other,"Flagship outreach and education effort of Rensselaer Polytechnic Institute’s Nanotechnology Center 
Crunchbase and ProPublica did not clarify
- I think this is an ""other""
- ",Web Service,Online visual learning,Education,#ERROR!,Excite audiences of all ages to explore and understand the molecular nature of the world through immersive and interactive media ,The Molecularium Project’s mission is to expand science literacy and awareness. ,,National,
Dragon Box,https://www.dragonboxapp.com/,,"S1 - Fear,S3 - Trying",,,Corporation,,"Product,Web Service",An app with tailored Math games ,Education,#ERROR!,"DragonBox is an educational software company dedicated to creating a learning tool that makes it fast, and easy, to learn algebra.","To create the best learning experiences for children, both at home and at school.",,International,
edX,https://www.edx.org/,,"S3 - Trying,S4 - Mastery",,,Non-Profit,,"Product,Web Service",Online college courses,Education,#ERROR!,"Created by Harvard and MIT, this online course hosts university-level courses in a wide range of disciplines to students worldwide including some at no charge","Increase access to high-quality education for everyone, everywhere",,International,
Dance/NYC,https://www.dance.nyc/,,S3 - Trying,,,Non-Profit,,"In-Person Service,Funding","What would I categorize funding under? 
I classified funding as a product
PG: Issue resolved","Education,Disability & Inclusion",#NAME?,"Through research, they connect and educate constituents, strengthening the collective voice of dance","Dance/NYC's mission is to promote the knowledge, appreciation, practice, and performance of dance in the metropolitan New York City area. It embeds values of justice, equity, and inclusion into all aspects of the organization.",,New York City,
Muscular Dystrophy Association,https://www.mda.org/,,S3 - Trying,,,Non-Profit,,"In-Person Service,Content,Funding","Again, I classified funding as a product
PG: Issue resolved",Disability & Inclusion,#ERROR!,"Spearhead efforts to transform the lives of people with muscular dystrophy, ALS, and related neuromuscular diseases. We fund groundbreaking research for promising treatments and provide families with the highest quality care from the best doctors in the country. One of their main initiatives is MDA Summer Camp, which is where I think we should partner. ",create more hope and answers for families living with muscular dystrophy and related diseases that take away physical strength and mobility. ,,National,
New York Junior Tennis & Learning Inc,https://www.nyjtl.org/,,S3 - Trying,,,Non-Profit,,In-Person Service,,Experiential Learning,#ERROR!,Develop youth development and character through tennis and education. It is the largest youth tennis and education program in the nation. ,To develop the character of young people through tennis and education for a lifetime of success on and off the court. ,,New York City,
Hip Hop Detoxx,https://www.hiphopdetoxx.org/,,S3 - Trying,,,Non-Profit,,In-Person Service,"They offer assemblies and seminar-style meetings for schools, hospitals, government and social service organizations and faith based organizations","Education,SED,Experiential Learning",#ERROR!,"Hip-Hop Detoxx programs assists elementary through collegiate institutions, hospitals, city, state & and government agencies, community social service and faith based organizations  around the nation in their efforts to reduce violence and negative behaviors. ",This approach stresses the use of media and popular culture to teach urban youth critical thinking skills that informs them of their cultural heritage and initiates positive social development.,,National-might be narrower,
Code.org,https://code.org/about,,S3 - Trying,,,Non-Profit,,In-Person Service,,"Accessibility,Disability & Inclusion",#ERROR!,A nonprofit dedicated to expanding access to computer science in schools and increasing participation by women and underrepresented youth.,"Every student in every school has the opportunity to learn computer science, just like biology, chemistry or algebra.",,National,
**Top College Consultants,https://www.topcollegeconsultants.com/,,S3 - Trying,,,Corporation,,"In-Person Service,Content",,"Education,Disability & Inclusion",#ERROR!,"Improve access to college for students worldwide, especially those with learning differences or other challenges. Serving the full spectrum of learners. ",To give every student the best chance of being admitted to and succeeding in college. ,,National,
Ramapo For Children,https://ramapoforchildren.org/,,"S3 - Trying,S4 - Mastery,S1 - Fear,S2 - Comparison",,,Non-Profit,,In-Person Service,youth camp/family retreats/hires people with LATD/values diversity,"Experiential Learning,Disability & Inclusion",#ERROR!,"Ramapo’s mission is to keep young people from being relegated to the margins of their schools, programs, families, or communities because of challenging behaviors, cognitive disabilities, or other differences.","offering the adults in their lives a new lens through which to view challenging behaviors, and presenting a set of techniques and tools that, when mastered, enable adults to meet children’s needs and create nurturing environments in which all children can thrive.",,National,
Crisis Textline,https://www.crisistextline.org/,,S1 - Fear,,,Non-Profit,,Product,"impressive sponsors;
immediate communication technique; data shows low threshold for people with SEMH issues",Health & Wellness,#ERROR!,"on the most basic level, trains volunteers who support people in crisis via texting. more in depth, contributes to research and policy about mental health and disability","We work every day to help people in crisis. Usually, that’s helping texters move from their hot moment to cool and calm",,,
**Google AI Grant,https://www.blog.google/outreach-initiatives/google-org/ai-impact-challenge-grantees/,,S1 - Fear,,,"Corporation,Other","Part of Google's AI for Social Good Program
- Not sure its definitely a ""for-profit"", would put ""other"" though","Product,Funding",grant includes partnership with Google web designers - opportunity to combine forces,Technology,#NAME?,"May 7, 2019 announced 20 organizations that will share $25 million in grants from Google.org, credit and consulting from Google Cloud, mentoring from Google AI experts and the opportunity to join a customized accelerator program from Google Developers Launchpad. The selected projects address issues in the areas of health, economic opportunity and empowerment, environmental protection and conservation, education, misinformation and crisis and emergency response.",Invest in AI capabilities that expand opportunities for certain groups of people,,,
Leading Edge,https://www.leadingedgekids.com/,,S1 - Fear,,,Corporation,,,,"Education,Experiential Learning",#ERROR!,Before and after school programs for kids who struggle; includes social emotional learning programs,targeted methodologies for raising student achievement,,"National
",10 people
Class Dojo,https://www.classdojo.com/,,"S1 - Fear,S2 - Comparison",,,Corporation,,Product,SEL; major sponsors; wide-range of users; can cut across sectors (ex: Bettie goes to HS then her arts program; Dojo used for both),SED,#ERROR!,"Generates a live platform for positive behavior reinforcement, in which students create their own anime and are rewarded from points system. Also communication with caregivers","We don’t believe there is some “ideal” education, a one-size-fits-all model that all kids must fit",,International,40
Education First,https://www.ef.edu/,,S3 - Trying,,,Corporation,,In-Person Service,experiential learning,Education,#ERROR!,"facilitates study abroad, immersion programs, language-learning programs, graduate and internship opportunities","""Opening the World Through Education"" - global education programs around the world",,Global,
Humanim,https://humanim.org/what-we-do/,,"S1 - Fear,S3 - Trying,S4 - Mastery",,,Non-Profit,,"In-Person Service,Web Service,Content","coaching, peer-to-peer network, easy access on website, mentorship for people with LATD. cost $","Disability & Inclusion,Mentorship",#NAME?,"Humanim’s mission is to support and empower individuals who face social or economic challenges — by building pathways to economic equity, opportunity, and independence.
","strategies for people with LATD to thrive in school and the workplace, 35 different programs/services",,National / Maryland area,
Reddit/r/Disability,https://www.reddit.com/r/disability/,,"S1 - Fear,S2 - Comparison",,,"Corporation,Other","A subreddit within the for-profit company, reddit",Web Service,access to people who self-advocate ,Disability & Inclusion,#NAME?,simply a forum for people to post their questions and struggles with one another,"“On Reddit, users can be themselves, learn about the world around them, and be entertained by the content created and shared by our global community.”",,National + International,
Course Hero,https://www.coursehero.com/,,"S4 - Mastery,S3 - Trying",,,Corporation,,Content,interdisciplinary work; free online learning tools,Education,#NAME?,Membership to receive access to study materials; online tutoring and help,create supplementary study materials in order to demonstrate success,,,
Dot Com Therapy,https://www.dotcomtherapy.com/,,S1 - Fear,,,Corporation,,Content,"35 different therapists; licensed social workers; ""Teletherapy and ASD"" is a June 2019 initiative, so disability is on their radar",Health & Wellness,#NAME?,"We believe each and every one deserves the very best therapy despite their location, so we hand-match children with the therapist best suited to their individual needs and connect them through our one-of-a-kind, online platform + app, Zesh",highest-quality of therapy right at your fingertips,,International,51-200
Outdoor Adventure Leader,http://www.outdooradventureleader.com/,,"S2 - Comparison,S3 - Trying,S4 - Mastery",,,Corporation,,"Content,In-Person Service",,"Experiential Learning,Disability & Inclusion",#ERROR!,"The vision of the Outdoor Adventure Leader is to be a co-creator of a future where diversity, inclusivity, and equity are all understood as fundamental characteristics of a mature society. Our world needs leaders who understand they cannot be neutral within any system of injustice. ","The mission of the Outdoor Adventure Leader is to be an active agent of positive social transformation within our fragile world, which is facing social and ecological crises at an existential level. ",,Regional,
Ancestral Knowledge,https://www.ancestralknowledge.org/,,"S2 - Comparison,S3 - Trying,S4 - Mastery",,,Non-Profit,,"Content,In-Person Service",,Experiential Learning,"- Experiential Learning
    - ""Native living"" Skill-building
","Ancestral Knowledge is a 501(c)3 non-profit organization. We are a community of naturalists who specialize in native living skills and primitive technology. Using Nature and the wilderness as our classroom, we offer hands-on experiential learning through the study of tracking, awareness and philosophies that support a sustainable lifestyle.","To teach ancient and modern technologies, activities, and philosophies that support a sustainable lifestyle through ongoing experiential programs, home study programs, workshops, lectures, apprenticeships, and other programs and services.",,Regional,
Camp Kessem,https://www.campkesem.org/,,"S1 - Fear,S2 - Comparison,S3 - Trying",,,Non-Profit,,In-Person Service,,Experiential Learning,#ERROR!,"Kesem is a nationwide community, driven by passionate college student leaders, that supports children through and beyond their parent’s cancer. Kesem is the largest national organization dedicated to supporting children impacted by a parent’s cancer, at no cost to families. Our innovative and fun-filled programs provide children with peers who understand their unique needs, and create long-lasting impact.","Kesem’s mission of supporting children through and beyond a parent’s cancer, and our vision of ensuring that every child impacted by a parent’s cancer is never alone, can only be realized through an ongoing, steadfast commitment to Diversity, Equity, and Inclusion in every part of our organization.",,National,
LumenLearning,https://lumenlearning.com/,,S3 - Trying,,,Corporation,,"Content,Web Service",,Education,#NAME?,"The Lumen team brings your institution deep expertise in the adoption and effective use of open educational resources (OER), design of highly effective online and technology-enhanced instruction, learning data analysis with a focus on improving outcomes, and community collaboration.",Lumen Learning’s mission is to enable unprecedented learning for all students.,,national,
Grammarly,https://www.grammarly.com/,,"S1 - Fear,S2 - Comparison,S3 - Trying,S4 - Mastery",,,Corporation,,"Web Service,Product",PG: Added product as an offering and removed content,"Education,Technology",#ERROR!,"At Grammarly, we strive to help people understand one another, whenever and wherever they communicate. More than 20 million people around the world use our AI-powered product every day to strengthen their writing and say what they really mean. Our writing assistant supports clean, mistake-free writing while offering suggestions that go way beyond grammar.",To improve lives by improving communication,,International,
The National Child Traumatic Stress Network,https://www.nctsn.org/,,S1 - Fear,,,Non-Profit,"NGO? The NCTSN is funded by the Center for Mental Health Services (CMHS), Substance Abuse and Mental Health Services Administration (SAMHSA), U.S. Department of Health and Human Services and jointly coordinated by UCLA and Duke University.","Content,In-Person Service,Media",,Health & Wellness,"- Health & Wellness
[Youth Traumatic Stress]
    - Information
    - Advocacy
    - Research
    - Services
","The National Child Traumatic Stress Network (NCTSN) was created by Congress in 2000 as part of the Children’s Health Act to raise the standard of care and increase access to services for children and families who experience or witness traumatic events. This unique network of frontline providers, family members, researchers, and national partners is committed to changing the course of children’s lives by improving their care and moving scientific gains quickly into practice across the U.S.","To accomplish the NCTSN mission, grantees and Affiliates work to provide clinical services, develop and disseminate new interventions and resource materials, offer education and training programs, collaborate with established systems of care, engage in data collection and evaluation, and inform public policy and awareness efforts",,National,
The Administration for Community Living,https://acl.gov/,,"S1 - Fear,S2 - Comparison,S3 - Trying",,,Government,,"Content,In-Person Service",,Disability & Inclusion,#ERROR!,"The Administration for Community Living was created around the fundamental principle that older adults and people of all ages with disabilities should be able to live where they choose, with the people they choose, and with the ability to participate fully in their communities.","Maximize the independence, well-being, and health of older adults, people with disabilities across the lifespan, and their families and caregivers.",,National,
The Child Center of NY,childcenterny.org,,S3 - Trying,,,Non-Profit,,In-Person Service,Services for children and families in need,Experiential Learning,#ERROR!,"The Center offers afterschool and summer extended learning programs, community schools, college and work readiness programs, internships, and specialized groups that focus on issues ranging from sexual health to community service. ",Our youth development programs enrich young people with the tools to grow into capable and confident adults.,,Local,
Tech Kids Unlimited,https://www.techkidsunlimited.org/,,S4 - Mastery,,,Non-Profit,,In-Person Service,Technology classes for students with LTDs,"Experiential Learning,Disability & Inclusion",#ERROR!,Tech Kids Unlimited (TKU) is a NYC-based organization that teaches computer science thinking and technology to kids who learn differently. ,"To open up the field of technology to students with disabilities, especially those with Autism Spectrum Disorders (ASD) to help them become the techies of tomorrow.",,Local,
JCC of Manhattan,jccmanhattan.org,,"S3 - Trying,S4 - Mastery",,,Non-Profit,,,,"Experiential Learning,Institution",#ERROR!,"A community center where children and young adults of all ages can attend educational programs (i.e. preschool, arts, sports, hobbies, summer camps, social action)","Together with our community, the Marlene Meyerson JCC Manhattan creates opportunities for people to connect, grow, and learn within an ever-changing Jewish landscape.",,Local,
Hugh O'Brian Youth Leadership (HOBY),www.hoby.org,,"S1 - Fear,S2 - Comparison,S3 - Trying,S4 - Mastery",,,Non-Profit,,In-Person Service,"Leadership training events on local, national, international levels",Experiential Learning,"'- Experiential Learning
    - Training (Leadership + Advocacy)","HOBY runs State Leadership Seminars to train high school students in public speaking, advocacy, and leadership.","To inspire and develop our global community of youth and volunteers to a life dedicated to leadership, service, and innovation",,National,
Hudson Guild,hudsonguild.org,,"S3 - Trying,S4 - Mastery",,,Non-Profit,,,,Experiential Learning,#ERROR!,"A holistic approach to academic support, enrichment activities, physical activity and healthy living","Young people, ages 5-24, attend Hudson Guild for academic achievement, life skills development, college and career training, employment experience, recreation, and social/emotional support",,Local,
Summer Youth Employment Program (SYEP),https://access.nyc.gov/programs/summer-youth-employment-program-syep/,,"S3 - Trying,S4 - Mastery",,,Government,,,,Employment,#ERROR!,Paid summer experiences for youth,Summer Youth Employment Program (SYEP) connects NYC youth 14 – 24 years old with career exploration opportunities and paid work experience each summer.,,Local,
National School Climate Center,www.schoolclimate.org,,"S1 - Fear,S2 - Comparison",,,Non-Profit,Connected to Ramapo for Children,"Content,Advocacy",An organization geared towards teachers and school leaders,"SED,Education","- SEL
- Education
    - [Training?]","The National School Climate Center promotes safe, supportive learning environments that nurture social and emotional, civic, and academic growth for all students.
",Our mission is to measure and improve the climate for learning in schools to help children realize their fullest potential as individuals and as engaged members of society.,,National,
Literacy Inc.,https://www.lincnyc.org/,,S2 - Comparison,,,Non-Profit,,"In-Person Service,Advocacy","Literacy enrichment programs for students, parents, and families ",Education,#ERROR!,"We are advocates for children’s literacy, committed to ending the literacy crisis. With deep ties to our target communities, we are personally invested in the wellbeing of our children. When a child reads, a community succeeds!","LINC provides a scaffolding of support that increases both children’s and parents’ access to literacy-building opportunities, raises expectations, generates an understanding of grade-level literacy skills, and provides simple reading strategies to support parents in helping their children, regardless of their own ability to read or speak English.",,Local,
Writopia Lab,www.writopialab.org,,"S3 - Trying,S4 - Mastery",,,Non-Profit,,"In-Person Service,Web Service","Creative Writing classes
[Web services offered now due to COVID-19]",Education,#ERROR!,Creative writing workshops for children 2-18,"Writopia Lab fosters joy, literacy, and critical thinking in children and teens from all backgrounds through creative writing.",,Local,
The Tenney School,tenneyschool.com,,"S3 - Trying,S4 - Mastery",,,Non-Profit,"Are private schools for-profit or non-profit like Universities? This is an accredited private school charging tuition
- some can be for-profit, like charter schools.  (JS)
Houston Area Independent Schools is a non-profit 501(c)6 professional association that includes 86 member schools throughout the greater Houston area. Membership in the organization is open to schools accredited by TEPSAC (Texas Private School Accreditation Commission) or by a religious organization.",In-Person Service,A school with one-on-one learning focus,"Institution,Education,Disability & Inclusion","- Institution
    - 1-on-1 School
- Education
- Disability & Inclusion?","We offer a one student to one teacher ratio. That means your child will receive tailored learning with personalized mentoring, one lesson at a time. We call this, the Power of One.",To provide high-quality education that meets students where they are and maximizes their talents,,Local,
EXPLO,www.explo.org,,S3 - Trying,,,Non-Profit,"EXPLO and Exploration Summer Programs are operated by Exploration School, a not-for-profit 501(c)3 educational organization",In-Person Service,"An educational, pre-college summer program ",Experiential Learning,#ERROR!,Summer programs where students can explore ,"EXPLO summer programs help students from grades 2-12 explore the world, develop agency to pursue their passions, and find their future selves.",,National,
Neurodiversity Hub,https://www.neurodiversityhub.org/,,"S2 - Comparison,S3 - Trying",,,Other,"This is the product of a ""Social Enterprise"" called Untapped. Untapped calls itself a network.
""a global initiative with goals and resources to support students, educators, and employers around diversity, inclusion, and meaningful employment for autistic people.""

@Jen Spindler Just a note that I feel like this org would be 1 degree separated from Understood (and maybe individuals as well). Could also use help identifying the org type.","Media,Content,Advocacy",A website providing resources to LTD indiividuals,"Employment,Disability & Inclusion",#ERROR!,A collaborative creating employment-related resources for individuals and employers - partners are leading tech companies and universities,"To create programs that prepare neurodivergent students to become work-ready, and build connections with organizations that value their talents.",,"International (expanding through UK, US, Australia)",
JobsFirstNY,https://jobsfirstnyc.org/,,"S2 - Comparison,S4 - Mastery",,,Other,"This looks like an NPO from the website but I can't find any of the standard confirming details.
- Does not come up in ProPublica
- Has a ""Donate"" page
- I think ""other"". (JS) In the 2019 annual report: says ""Nonprofit intermediary""","In-Person Service,Advocacy",A job skills training program ,Employment,#ERROR!,Leveraging public-private partnerships to create new career opportunities for disadvantaged youth 18-24,"JobsFirstNYC creates and advances solutions that ransform the systems supporting young adults and their communities in the pursuit of economic opportunities. Together with our partners, we embrace a collaborative 5-step process to identify challenges, incubate solutions, and advance what works.",,Local,
Opening Act,openingact.org,,S3 - Trying,,,Non-Profit,,In-Person Service,After-school theatre programs ,Experiential Learning,#ERROR!,After-school theatre program for underserved NYC public schools,"Opening Act seeks to level the playing field for our students by specifically partnering with NYC schools that have lower than average graduation rates (as few as 33% of students graduating in four years) and an evident lack of theater programming. Opening Act gives high school students opportunities to develop leadership, community, and commitment through its innovative, high quality, free, After-School Theater Program",,Local,
ModMath,www.modmath.com,,"S2 - Comparison,S3 - Trying",,,Non-Profit,ModMath operates through the fiscal sponsorship and nonprofit status given to us by MarinLink (501(c)(3),Product,,"Education,Disability & Inclusion",#ERROR!,"ModMath is a free app for the iPad, targeted at helping students with dyslexia and dysgraphia do math",To make math learning easier for  students who struggle to process it ,,,
Bridging Education and Art Together (B.E.A.T.),www.beatglobal.org,,S4 - Mastery,,,Non-Profit,,In-Person Service,A supplemental music class,"Experiential Learning,Disability & Inclusion,SED",#ERROR!,"BEAT uses Hip Hop as an art form to promote the values of peace, respect, and self-worth. ","To providee fun, accessible and culturally responsive workshops in schools to unleash the creative potential of our students.",,,
