Camp Dunnabeck,https://www.kildonan.org/camp-dunnabeck/,,"S1 - Fear,S2 - Comparison,S3 - Trying,S4 - Mastery",,,Non-Profit,[NPO but very high tuition],"In-Person Service,Content","We foster each child’s independence and growth in a fun and challenging setting. Learning positive social skills such as table manners is another part of our approach. At the end of the summer, campers are more confident not only academically, but socially, too.",,,Camp Dunnabeck is an academic summer camp for boys and girls ages 8 to 16 with dyslexia and language-based learning differences. We accept students of average to above-average intelligence.,NON-PROFIT YOUTH-CAMP OF THE KILDONAN ORGANIZATION,,,
"Kappa Alpha Psi Fraternity, Inc.",https://kappaalphapsi1911.com/,,"S2 - Comparison,S3 - Trying","S2 - Comparison,S3 - Matching","S2 - Comparison,S3 - Pathing,S4 - Resilience",Non-Profit,,"In-Person Service,Funding,Advocacy","Programs for children and teenagers, college scholarships ","Community Service,Mentorship",,"Kappa Alpha Psi Fraternity, Incorporated (ΚΑΨ) is a historically African-American intercollegiate Greek-letter fraternity. Since the fraternity's founding on January 5, 1911 at Indiana University Bloomington, the fraternity has never limited membership based on color, creed or national origin.","Through its worldwide prominence, Kappa Alpha Psi® has had a global impact on events which affect our local communities as well as places around the globe.  Local chapters of Kappa Alpha Psi® participate in community outreach activities to feed the homeless, provide scholarships to young people matriculating to college, serve as mentors to young men, participate in blood drives and serve as hosts of seminars for public health awareness to name a few.",,International,"The fraternity has over 160,000 members with 721 undergraduate and alumni chapters in every state of the United States, and international chapters in the United Kingdom, Germany, South Korea, Japan, United States Virgin Islands, Nigeria, South Africa, and The Bahamas."
"Alpha Kappa Alpha Sorority, Incorporated",https://aka1908.com/home,,"S2 - Comparison,S3 - Trying","S2 - Comparison,S3 - Matching","S2 - Comparison,S3 - Pathing,S4 - Resilience",Non-Profit,,"In-Person Service,Funding,Advocacy","Programs for children and teenagers, college scholarships ","Community Service,Mentorship",,"As Alpha Kappa Alpha (AKA) has grown, it has maintained its focus in two key arenas: the lifelong personal and professional development of each of its members; and galvanizing its membership into an organization of respected power and influence, consistently at the forefront of effective advocacy and social change that results in equality and equity for all citizens of the world.","Alpha Kappa Alpha’s mission is to cultivate and encourage high scholastic and ethical standards, to promote unity and friendship among college women, to study and help alleviate problems concerning girls and women in order to improve their social stature, to maintain a progressive interest in college life, and to be of “Service to All Mankind"".",,International,"Alpha Kappa Alpha is comprised of nearly 300,000 members in approximately 1,018 graduate and undergraduate chapters in the United States, the U.S. Virgin Islands,  the Bahamas, Bermuda, Canada, Dubai, Germany, Japan, Liberia, and South Korea."
"Alpha Phi Alpha Fraternity, Incorporated",https://apa1906.net/,,"S2 - Comparison,S3 - Trying","S2 - Comparison,S3 - Matching","S2 - Comparison,S3 - Pathing,S4 - Resilience",Non-Profit,,"In-Person Service,Funding,Advocacy","Programs for children and teenagers, college scholarships ","Community Service,Mentorship",,"Alpha Phi Alpha Fraternity, Incorporated (ΑΦΑ) is the first historically African American intercollegiate Greek-lettered fraternity.","Its aims are ""Manly Deeds, Scholarship, and Love For All Mankind,"" and its motto is ""First of All, Servants of All, We Shall Transcend All.""",,International,"The fraternity has over 290,000 members and has been open to men of all races since 1945. Currently, there are more than 730 active chapters in the Americas, Africa, Europe, the Caribbean, and Asia. It is the largest predominately African-American intercollegiate fraternity and one of the ten largest intercollegiate fraternities in the nation."
"Delta Sigma Theta Sorority, Inc.",https://deltasigmatheta.org/,,"S2 - Comparison,S3 - Trying","S2 - Comparison,S3 - Matching","S2 - Comparison,S3 - Pathing,S4 - Resilience",Non-Profit,,"In-Person Service,Funding,Advocacy","Programs for children and teenagers, college scholarships ","Community Service,Mentorship",,"Delta Sigma Theta Sorority, Incorporated (ΔΣΘ) is a historically African American Greek-lettered sorority. The organization was founded by college-educated women dedicated to public service with an emphasis on programs that assist the African American community. ","Delta Sigma Theta Sorority, Incorporated is an organization of college educated women committed to the constructive development of its members and to public service with a primary focus on the Black community. ",,International,"One of the largest predominately black sororities, the more than 300,000 initiated members are mostly college-educated women. The sorority currently has over 940 chapters located in the Bahamas, Bermuda, Canada, England, Germany, Jamaica, Japan, Liberia, South Korea, and the United States."
"Zeta Phi Beta Sorority, Inc.",https://zphib1920.org/,,"S2 - Comparison,S3 - Trying","S2 - Comparison,S3 - Matching","S2 - Comparison,S3 - Pathing,S4 - Resilience",Non-Profit,,"In-Person Service,Funding,Advocacy","Programs for children and teenagers, college scholarships ","Community Service,Mentorship",,"Zeta Phi Beta Sorority, Incorporated (ΖΦΒ) is an international, historically African American Greek-lettered sorority. In 1920, five women from Howard University envisioned a sorority that would raise the consciousness of their people, encourage the highest standards of scholastic achievement, and foster a greater sense of unity among its members.","To foster the ideas of service, charity, scholarship, civil and cultural endeavors, sisterhood and finer womanhood. These ideals are reflected in the sorority's national program for which its members and auxiliary groups provide voluntary service to staff, community outreach programs, fund scholarships, support organized charities, and promote legislation for social and civic change.",,International,"Zeta Phi Beta Sorority, Inc. has a membership of 100,000+ and is divided into eight intercontinental regions and 800+ Chapters located in the US, Africa, Europe, Asia and the Caribbean"
"Phi Beta Sigma Fraternity, Inc",http://phibetasigma1914.org/,,"S2 - Comparison,S3 - Trying","S2 - Comparison,S3 - Matching","S2 - Comparison,S3 - Pathing,S4 - Resilience",Non-Profit,,"In-Person Service,Funding,Advocacy","Programs for children and teenagers, college scholarships ","Community Service,Mentorship",,"Phi Beta Sigma Fraternity, Incorporated (ΦΒΣ) is a historically African-American intercollegiate Greek letter fraternity. It was founded at Howard University in Washington, D.C. on January 9, 1914, by three young African-American male students with nine other Howard students as charter members.","The brothers of Phi Beta Sigma are the Fraternity’s most valuable resource and strength. They are the primary means by which the Phi Beta Sigma objectives will be achieved. In order to accomplish the Fraternity’s objectives, it is essential that systems are instituted that effectively embody “Culture For Service and Service For Humanity” and promote brotherhood, scholarship and service.",,International,"Today, the fraternity serves through a membership of more than 200,000 men in over 700 chapters in the United States, Africa, Europe, Asia, and the Caribbean."
Omega Psi Phi Fraternity Inc.,https://oppf.org/,,"S2 - Comparison,S3 - Trying","S2 - Comparison,S3 - Matching","S2 - Comparison,S3 - Pathing,S4 - Resilience",Non-Profit,,"In-Person Service,Funding,Advocacy","Programs for children and teenagers, college scholarships ","Community Service,Mentorship",,"Omega Psi Phi Fraternity, Incorporated (ΩΨΦ) is a historically African American intercollegiate Greek-letter fraternity. ","Since its founding in 1911, Omega Psi Phi's stated purpose has been ""to attract and build a strong and effective force of Handsome men dedicated to its Cardinal Principles of manhood, scholarship, perseverance, and uplift"".",,International,"Over 250,000 men have been initiated into Omega Psi Phi throughout the United States, Bermuda, Bahamas, Virgin Islands, South Korea, Japan, Liberia, Germany, and Kuwait."
Iota Phi Theta Fraternity Inc.,https://www.iotaphitheta.org/,,"S2 - Comparison,S3 - Trying","S2 - Comparison,S3 - Matching","S2 - Comparison,S3 - Pathing,S4 - Resilience",Non-Profit,,"In-Person Service,Funding,Advocacy","Programs for children and teenagers, college scholarships ","Community Service,Mentorship",,"Iota Phi Theta Fraternity, Incorporated (ΙΦΘ) is a historically African-American, intercollegiate Greek letter fraternity. It was founded on September 19, 1963, at Morgan State University (then Morgan State College) in Baltimore, Maryland, and now has initiated over 30,000 members."," ""The Development and Perpetuation of Scholarship, Leadership, Citizenship, Fidelity, and Brotherhood among Men.""",,International,"30,000 members in 301 undergraduate and alumni chapters, as well as colonies located in 40 U.S. states, the District of Columbia, The Bahamas, Colombia, South Korea, and Japan."
United Negro College Fund,https://uncf.org/,,S3 - Trying,,,Non-Profit,,"In-Person Service,Funding,Advocacy",,"Education,Equity and Social Justice",,"UNCF, the United Negro College Fund, also known as the United Fund, is an American philanthropic organization that funds scholarships for black students and general scholarship funds for 37 private historically black colleges and universities.","UNCF’s mission is to build a robust and nationally-recognized pipeline of under-represented students who, because of UNCF support, become highly-qualified college graduates and to ensure that our network of member institutions is a respected model of best practice in moving students to and through college.",,National,37 private historically black colleges and universities
"The Links, Incorporated ",http://www.linksinc.org/,,"S2 - Comparison,S3 - Trying",,"S2 - Comparison,S3 - Pathing,S4 - Resilience",Non-Profit,,"In-Person Service,Funding,Advocacy","Programs for children and teenagers, college scholarships ",,,"The Links, Incorporated is an international, non-for-profit corporation, established in 1946. It is one of the nation’s oldest and largest volunteer service organizations.","Our core values are friendship, integrity, honesty, service, commitment, family relationships, courage, respect for self and others, legacy, confidentiality, responsibility, and accountability. The members of The Links, Incorporated are influential decision makers and opinion leaders.",,International,"The membership consists of more than 16,000 professional women of color in 288 chapters located in 41 states, the District of Columbia, the Commonwealth of the Bahamas, and the United Kingdom."
The National Association for the Advancement of Colored People (NAACP),https://www.naacp.org/,,"S1 - Fear,S2 - Comparison,S3 - Trying","S2 - Comparison,S3 - Matching","S1 - Hopelessness,S2 - Comparison,S3 - Pathing,S4 - Resilience",Non-Profit,,"Content,In-Person Service,Media,Funding,Advocacy",,,,"The National Association for the Advancement of Colored People (NAACP) is a civil rights organization in the United States, formed in 1909 as an interracial endeavor to advance justice for African Americans","Its mission in the 21st century is ""to ensure the political, educational, social, and economic equality of rights of all persons and to eliminate race-based discrimination"". National NAACP initiatives include political lobbying, publicity efforts and litigation strategies developed by its legal team.",,National,"500,000 members"
Southern Christian Leadership Conference,https://nationalsclc.org/,,"S1 - Fear,S2 - Comparison,S3 - Trying,S4 - Mastery",,,Non-Profit,,"Content,In-Person Service,Advocacy",Programs for children and teenagers,,,"The Southern Christian Leadership Conference is a nonprofit, non-sectarian, inter-faith, advocacy organization that is committed to nonviolent action to achieve social, economic, and political justice.","In the spirit of Dr. Martin Luther King, Jr., the Southern Christian Leadership Conference (SCLC) is renewing its commitment to bring about the promise of “one nation, under God, indivisible” together with the commitment to activate the “strength to love” within the community of humankind.",,National,
"Chums, Inc.",https://www.chums-inc.org/,,"S2 - Comparison,S3 - Trying",,,Non-Profit,,"Content,In-Person Service,Advocacy",Programs for children and teenagers,,,"Chums, Inc. is a non-profit organization that provides opportunities for women to meet in friendship and fun, to encourage a spirit of helpfulness, and to use their many talents in service to the community. ","Through the years, the group has devoted itself to the betterment of social, civic and cultural relationships in their communities. The national theme ""Listen to the Children... enrich their lives"" guides each chapter in determining its community's needs. ",,National,
National Student Leadership Conference,https://www.nslcleaders.org/,,"S1 - Fear,S2 - Comparison,S3 - Trying,S4 - Mastery",,,Non-Profit,"Sponsored by the National Student Leadership Foundation, a 501(c)3",In-Person Service,,,,"The NSLC provides students with the opportunity to experience life on a college campus; develop essential leadership skills; and explore a future career through exciting simulations, exclusive site visits and interactive meetings with renowned leaders in their chosen field.",The mission of the National Student Leadership Conference is to provide a safe and supportive environment that encourages students to explore their academic and career interests while developing leadership skills essential for their success.,,National,
National Student Leadership Diversity Convention,http://nsldc.org/,,"S2 - Comparison,S3 - Trying,S4 - Mastery",,,Non-Profit,Run by the Ceceilyn Miller Institute,In-Person Service,,,,"The conference is open to all students who aspire to be agents of positive social change on their campuses, including students who are involved in Student Government, Campus Culture Club/Organizations, Student Activity Boards, Greek Organizations or Multicultural Clubs.","The overarching goal of the NSLDC is to help students become stronger leaders in their organizations and campuses, empowering them to create a more accepting, equitable environment and preparing them to work effectively in a diverse workplace. ",,National,
The American Legion,https://www.legion.org/,,"S1 - Fear,S2 - Comparison,S3 - Trying,S4 - Mastery",,,Non-Profit,,"In-Person Service,Funding,Advocacy",Boys State for rising high school seniors - free for attendees,,,"The American Legion was chartered and incorporated by Congress in 1919 as a patriotic veterans organization devoted to mutual helpfulness. It is the nation’s largest wartime veterans service organization, committed to mentoring youth and sponsorship of wholesome programs in our communities, advocating patriotism and honor, promoting strong national security, and continued devotion to our fellow servicemembers and veterans.",Hundreds of local American Legion programs and activities strengthen the nation one community at a time. ,,National,
American Legion Auxiliary,https://www.alaforveterans.org/,,"S1 - Fear,S2 - Comparison,S3 - Trying,S4 - Mastery",,,Non-Profit,,"In-Person Service,Funding,Advocacy",Girls State for rising high school seniors - free for attendees,,,"The American Legion Auxiliary is an auxiliary organization of the American Legion composed of spouses of American war veterans. Founded in 1919, the ALA is dedicated to serving veterans, military, and their families.","In the spirit of Service, Not Self, the mission of the American Legion Auxiliary is to support The American Legion and to honor the sacrifice of those who serve by enhancing the lives of our veterans, military, and their families, both at home and abroad.",,National,
Planned Parenthood ,https://www.plannedparenthood.org/,,"S1 - Fear,S2 - Comparison,S3 - Trying",,,Non-Profit,,"Content,In-Person Service,Funding,Advocacy,Product",,,,"Planned Parenthood is a trusted health care provider, an informed educator, a passionate advocate, and a global partner helping similar organizations around the world. Planned Parenthood delivers vital reproductive health care, sex education, and information to millions of women, men, and young people worldwide. ","On campuses and online, in statehouses and courts, in community settings, and in the media, Planned Parenthood is a visible and passionate advocate for policies that enable Americans to access comprehensive reproductive and sexual health care, education, and information. Whether talking with members of Congress, parents, or faith leaders, or arguing cases before the U.S. Supreme Court, we fight for commonsense policies that promote women’s health, allow individuals to prevent unintended pregnancies through access to affordable contraception, and protect the health of young people by providing them with comprehensive sex education.",,International,"Our 49 unique, locally governed affiliates nationwide operate more than 600 health centers, which reflect the diverse needs of their communities."
Nurx,https://www.nurx.com/,,"S1 - Fear,S3 - Trying",,,Corporation,,"Content,Web Service,Product",,,,"Nurx is built to deliver on the three things everyone needs from their healthcare. Choice, so you can make positive decisions about your own body. Control, so you can plan ahead and look after yourself without complication. And freedom, so your access to medication is never blocked by cost, bureaucracy, geography, stigma, or anything else.","We believe healthcare should be unconditional. It doesn’t matter who you are or what you get up to in your own time. You deserve to be treated quickly and with compassion. That’s why we’re pioneering a new type of healthcare that’s easier and smarter, one in which vital medications and tests are accessible and affordable to everyone. No ifs, no buts.",,National,
**New Visions,newvisions.org,,,,,Non-Profit,Note: Rachel originally included this web address as part of another record so I fixed the addres and added a new row. Need to go back and fill in the details.,,,,,,,,,
Urban Tech,https://www.urbantech.org/index.cfm,,,S1 - Dependency,,Non-Profit,,"Product,Funding,Web Service",Providing learning and teaching assistance with several different programs that they offer.,SED,#ERROR!,Teaching Student's emotions towards ones self communicated through art.,Teaching and supporting students for Social & Emotional knowledge with their learning programs.,,"National	
",
Psychology Today,https://www.psychologytoday.com/us,,,S1 - Dependency,,Corporation,It is a product by Sussex Publishers LLC,"Content,Web Service",Provides information for psychological help as well as a network of people who can help in this field. ,Health and Wellness,"'- Health and Wellness
    - Online Magazine
    - Expert advice (Subpages in disability and mental health)",Provide information on mental health and give a network of people and places to go to for help for the specific issues that people are dealing with.,Helps psychologist grow their network. Informing and helping people find the support they need for their mental health.,,US	,
Reach,https://www.reach.services/,,,S1 - Dependency,,Non-Profit,,"In-Person Service,Web Service,Advocacy","They provide personalized support, assistance  and guidance through their 3 main services for people with disabilities","Disability & Inclusion,Independent Living",#ERROR!,"Help people with LTD with communication, learning and housing.",Support people in life through challenges that they face.,,"Local- Southeast Los Angeles, San Gabriel Valley, and North Orange County areas",
Brainline,https://www.brainline.org/,,,S1 - Dependency,,Non-Profit,"BrainLine is a service of WETA, the public TV and radio station in Washington, DC. ",Content,,"Advocacy,Education",#ERROR!,Provide information from experts dealing with brain issues.,Help people who have or had a brain injury or PTSD.,,National	,
The New York Foundling,https://www.nyfoundling.org/,,,S1 - Dependency,,Non-Profit,,In-Person Service,Support for people with developmental disabilities is among many programs offered,Health and Wellness,#ERROR!,"Helping people in need through different programs focused on their diverse focus areas. Children navigate through foster care, families financial issues, helping people with LTD thrive, and mental health services that relate to the previous ones. ",Helping people despite differences and difficulty to reach their full potential.	,,"New York City, Rockland County, Puerto Rico",
Source America,https://www.sourceamerica.org/,,,"S4 - Employment,S1 - Dependency",,Non-Profit,,In-Person Service,,"Employment,Disability & Inclusion",#ERROR!,Works as the middle man between people with LTD and work that best suits them and trains them as well.,Everyone is given fair chance to find the work they need and want.,,National,
Easter Seals,https://www.easterseals.com/,,,"S4 - Employment,S1 - Dependency",,Non-Profit,,"Content,Product",,"Independent Living,Disability & Inclusion",#ERROR!,"Providing services to support people in need of health, education, work training, LTD, transportation, living, and older adults.",ensuring that everyone – regardless of age or ability – is 100% included and 100% empowered.,,National,
Brilliant,https://brilliant.org/,,,S4 - Employment,,Corporation,"Unclear status but requires payment to use services after a free trial
JS - Crunchbase says ""For-profit""",Product,,Skill-building,#ERROR!,"Making learning more engaging, accessible, and fun to help people build their skills around the STEM areas.","Brilliant's mission is to inspire and develop people to achieve their goals in STEM – one person, one question, and one small commitment to learning at a time. We enable great teachers to illuminate the soul of math, science, and engineering through bite-sized, interactive learning experiences. Our courses explore the laws that shape our world, and elevate math and science from something to be feared to a delightful experience of guided discovery. We aim to cultivate a world of better learners, thinkers, and problem solvers.",,National,40 people
80000 hours,https://80000hours.org/,,,"S4 - Employment,S3 - Matching",,Non-Profit,,Content,,"Employment,Equity and Social Justice",#ERROR!,Provides research and support to help people switch into careers that effectively tackle the world’s most pressing problems.,Guide people to find the right fit career for them,,Global,
Career Girls,https://www.careergirls.org/,,,"S4 - Employment,S3 - Matching",,Non-Profit,,Content,,"Employment,Mentorship",#ERROR!,Helps prepare girls for their career,"To ensure that every girl has access to diverse and accomplished women role models, can learn from their experiences, and has access to the tools and resources needed to discover her own path to empowerment.",,Nation,30 people (including special advisors) **all volunteers
Career One Stop,https://www.careeronestop.org/,,,"S3 - Matching,S4 - Employment,S2 - Comparison",,Government,Sponsored by the US Department of Labor- How does status work in this case?,"Content,Product,Web Service",Zach: there's a secondary school initiative for high schoolers https://www.careeronestop.org/FindTraining/Types/high-school-equivalency.aspx,"Employment,Skill-building",#ERROR!,"Abdullah: Helps people find work and training that best suits them

Zach: These tools and resources serve job seekers, students, workers, workforce intermediaries, and employers to enhance their employment opportunities and business prosperity. They have a bunch of programs that help people find jobs suitable for them, explore new career paths, plan their future, and more.","CareerOneStop is the flagship career, training, and job search website for the U.S. Department of Labor. The website serves job seekers, businesses, students, and career advisors with a variety of free online tools, information and resources. 

To deliver integrated, easy-to-understand workforce information that helps job seekers, students, workers, workforce intermediaries, and employers develop their capacity and make sound economic decisions in the new economy.",,National,
National Disability Rights Network,https://www.ndrn.org,,,"S2 - Comparison,S1 - Dependency",,Non-Profit,nonprofit membership organization for the federally mandated Protection and Advocacy (P&A) Systems and the Client Assistance Programs (CAP) for individuals with disabilities.,Advocacy,Improve lives of people with LATD,Advocacy,#ERROR!,Promote the integrity and capacity Protection and Advocacy Systems and Client Assistance programs for individuals with disabilities.,NDRN’s mission is to promote the integrity and capacity of the P&A and CAP national network and to advocate for the enactment and vigorous enforcement of laws protecting civil and human rights of people with disabilities.,,National,About 40 employees
