Organization,Org Website,Moment 1,Moment 2,Moment 3,Moment 4,Type of Org,Type of Org Expanded,Offering,Offering Expanded,Keyword,Keyword Expanded,Description,Mission,Target Audience,Geographic Reach,Org Size
Khan Academy,https://www.khanacademy.org/,"S1 - Confusion,S2 - Comparison","S2 - Comparison,S1 - Fear,S3 - Trying,S4 - Mastery",,,Non-Profit,,Web Service,,Education,#NAME?,"Khan Academy offers practice exercises, instructional videos, and a personalized learning dashboard that empower learners to study at their own pace in and outside of the classroom. They tackle math, science, computing, history, art history, economics, and more, including K-14 and test preparation (SAT, Praxis, LSAT) content.","provide a free, world-class education for anyone, anywhere.",,Global,150
AHRC,https://www.ahrcnyc.org/services/school/ahrc-nyc-schools/ ,S2 - Comparison,,,,Non-Profit,,In-Person Service,,"Education,Disability & Inclusion",#NAME?,"A family governed organization committed to finding ways for people with intellectual and other developmental disabilities to build full lives as defined by each person and supported by dedicated families, staff and community partners.","Through passion, respect, integrity, diversity and excellence, they envision a society where people with intellectual and developmental disabilities can lead fulfilling lives. ",,New York City,
Headspace For Educators,https://www.headspace.com/educators-covid-19,"S3 - Coping,S4 - Acceptance",,,,Corporation,,"Media,Content","an app that builds towards  emotional skills like empathy, compassion, improving relationships. also addresses small 1-2 minute meditations that address frustrations like anger and boredom",Health & Wellness,#NAME?,app with audio meditations + tools for developing mindfulness meditations and practices in the classroom,"for educators; less stress, more focus, reduce burn-out. for students; managing anxiety, enhance focus; acceptance",,"national
",
The Chopra Center,https://chopra.com/,"S3 - Coping,S4 - Acceptance",,,,Corporation,,"Content,In-Person Service,Web Service",,Health & Wellness,#NAME?,"The Chopra Center, founded in 1996 by Deepak Chopra, M.D. and David Simon, M.D., is one of the first whole health brands in the U.S. and premier provider of experiences, education, teacher certifications and products that improve the health and well-being of, mind, body, and spirit. We provide an integrative approach to total well-being through the awareness of physical, emotional, spiritual, relationships, and purposes and the related practices of yoga, meditation, and Ayurveda.","Our purpose is to empower personal transformation for our collective well-being by providing tools, guidance and community anchored in wisdom traditions and cutting-edge science for mind, body, & spirit.",,national,
Calm.com,https://www.calm.com/blog/about,S3 - Coping,,,,Corporation,,"Media,Content","relaxation and calm through sensory input like sounds of nature, the ocean. Athlete portion about enhancing workouts; ASMR (autonomous sensory meridian response)",Health & Wellness,#NAME?,"app provides videos of body movement, scenes of nature, sleep sounds, ""Master Classes"" by experts","""make the world happier and healthier""",,national,50
Karma Bliss by Devi Brown,https://www.karmabliss.com/     ,"S1 - Confusion,S3 - Coping,S4 - Acceptance",,,,Corporation,,"Content,In-Person Service,Web Service",,Health & Wellness,#NAME?,"Ancient healing for the modern soul.
",Supporting w.o.c on their journey to healing & wholeness. ,,national,
"Bene Brown Podcast ""Unlocking Us""",https://brenebrown.com/podcast/introducing-unlocking-us/,S4 - Acceptance,,,,"Corporation,Other",,"Content,Media","influential in the self-help and self-actualization community. ""Universal experience of being human"" aligns to Understood's mission",SED,#ERROR!,,Bene Brown produces podcasts that tackle different elements of struggle and development,,"national
",
Metropolitan Center for Research on Equity and the Transformation of Schools,https://steinhardt.nyu.edu/metrocenter,"S1 - Confusion,S3 - Coping",,,,Non-Profit,,"Content,In-Person Service",,Education,#NAME?,"The NYU Metro Center is nationally and internationally renowned for its work on educational equity and school improvement. It brings together scholars, educators, and innovators from diverse backgrounds to collaborate on a range of projects to strengthen and improve access, opportunity, and educational quality across varied setting, but particularly in striving communities.","The Center has a broad and bold research agenda that touches topics ranging from girls and juvenile justice to the education, language, and literacy of men and boys of color. Research activities also include (but are not limited to) topics on the impacts of poverty on student learning, multilingual education, school climate and discipline, disproportionality, gender identity and gender presentation, restorative justice, PBIS, RTI, culturally relevant education, ""over-the-counter"" students, SIFE/SLIFE, abilities and special education, diversity and integration, and so on. ",,national,
Education Week,https://www.edweek.org/ew/index.html,"S1 - Confusion,S2 - Comparison,S3 - Coping,S4 - Acceptance",,,,Non-Profit,,"Content,Web Service,Media",,Education,#NAME?,"Education Week is an independent news organization that provides comprehensive coverage on K-12 education news, analysis, and opinion.",We believe that an excellent education is possible for all students and our mission is to inspire and empower our readers to continue advancing the field every day.,,national,
American Sociological Association,https://www.asanet.org/,"S2 - Comparison,S3 - Coping",,,,Professional Org,,"In-Person Service,Content",,Education,"***May not be the best tag
- Education
    - Sociological Resources (for people in the field)
","As the national organization for sociologists, the American Sociological Association, through its Executive Office, is well positioned to provide a unique set of services to its members and to promote the vitality, visibility, and diversity of the discipline.",The association aims to articulate policy and implement programs likely to have the broadest possible impact for sociology now and in the future.,,national ,
"YAI - Young Adult Institute ""Seeing Beyond Disabilities""",https://www.yai.org/,"S1 - Confusion,S3 - Coping,S4 - Acceptance,S2 - Comparison",,,,Non-Profit,,"In-Person Service,Advocacy","4,000 employees; knowledge of ADA and laws that guarantee certain rights to people with LATD. Holds a system of service providers who assist people with LATD (behaviorists, therapists, coaches, mentors, etc)",Health & Wellness,#NAME?,"eligibility center for receiving nationally mandated services for Intellectual or Developmental Disability in NY, CA & NJ","innovative services and accommodations that enable people to find employment, homecare and independence",,NY/NJ/CA,"4,000 employees"
Association for Supervision and Curriculum Development,http://www.ascd.org/Default.aspx,"S3 - Coping,S4 - Acceptance",,,,Professional Org,,"Content,In-Person Service",,Education,#ERROR!,"ASCD empowers educators to achieve excellence in learning, teaching, and leading so that every child is healthy, safe, engaged, supported, and challenged.","It has focused not just on the academic goals of curriculum, but also on education's broader social dimensions, including the development of students' moral and creative capacities and an understanding of their diverse needs. It called for greater collaboration and cross-pollination between district leaders, school principals, and teachers (a priority soon reflected in its membership). And it sought to provide a trustworthy and independent forum for educator voice, support, and idea sharing, including on controversial and challenging issues.",,national,
Go Noodle,https://www.gonoodle.com/,S3 - Coping,,,,Corporation,,"Content,Product","platform used by educators, OT and caregivers to place understood content; used in 185 countries in the world,  Yes! You! ""respectAbility"" initiative; wide range of school personnel utilize this;",Health & Wellness,#NAME?,"provides videos and tools like videos/workshops for educators and families that utilize organized movement, songs, rhythm, kinesthetic learning
","""Good energy"" through body movement and vibes via educational resources.",,185 countries in the world,
Inclusive U,https://taishoffcenter.syr.edu/inclusiveu/,"S4 - Acceptance,S2 - Comparison",,,,Non-Profit,,In-Person Service,"learn about a program that partners with local secondary school & university; facilities social development; Peer2Peer Mentorship Program; ""Self Determination  Skill Development"", Transition Support","Institution,Disability & Inclusion",#NAME?,"Connected to the Taishoff Center for Inclusive Higher Education
",Extended learning opportunities post secondary education within a University atmosphere,,"National; Around the Syracuse area
",
LEGO Foundation ,https://www.legofoundation.com/en/about-us/how-we-work/grant-opportunities/,"S1 - Confusion,S2 - Comparison",,,,Foundation,,Funding,oodles of foundation money,Education,#NAME?,non-profit port of LEGO toy company that funds projects and research around childhood development and play,"aims to measure holistic learning of ""play"" before/during primary education begins ",,International,
Insight Timer,https://insighttimer.com/,"S3 - Coping,S4 - Acceptance",,,,Corporation,,"Web Service,Content",,Health & Wellness,#NAME?,"Home to 16 million meditators, 7,000 meditation teachers, and over 45, 000 free guided-meditations. The most popular free meditation app.","The largest free library of guided meditations on earth with more than 45,000 titles. With beautiful Tibetan singing bowls and a dynamic worldwide meditation community, Insight Timer is the fun, connected way to support your meditation practice.",,International,
TED Talk,https://www.ted.com/about/partner-with-ted,S4 - Acceptance,,,,Non-Profit,,Content,,Education,***Education feels like the closest tag but may require more consideration.,"surprising amount of offers besides conferences and talks.  culture building, professional development",a global community to spread ideas,,"International
",
Edutopia run by the George Lucas Educational Foundation,https://www.edutopia.org/,"S1 - Confusion,S2 - Comparison,S3 - Coping,S4 - Acceptance",,,,"Non-Profit,Foundation",,"In-Person Service,Media,Content",,Education,#NAME?,"Edutopia is a trusted source shining a spotlight on what works in education. We show people how they can adopt or adapt best practices, and we tell stories of innovation and continuous learning in the real world.","Our Foundation is dedicated to transforming K-12 education so that all students can acquire and effectively apply the knowledge, attitudes, and skills necessary to thrive in their studies, careers, and adult lives. Founded by innovative and award-winning filmmaker George Lucas in 1991, we take a strategic approach to improving K-12 education through two distinct areas of focus: Edutopia and Lucas Education Research.",,National,
Jumprope Mastery-based Grading,https://www.jumpro.pe/,"S1 - Confusion,S2 - Comparison",,,,Corporation,,Product,"for people with LATD: color-coded, adjustable format, uses image icons and economy of language. For schools: enables rubrics and measurement of ""immeasurable"" skills like creativity, collaboration. ",Education,#NAME?,Consultancy. Designs mastery-skills based grading and curriculum systems for schools.,"tools to empower teachers, families and students to track their learning experience",,"National
",
MIND in the Making ,https://www.mindinthemaking.org/,"S1 - Confusion,S2 - Comparison",,,,Non-Profit,,"Web Service,Product,Content","language around executive functioning, apps that cater to learning like self-control, perspective taking, etc.","Education,SED",#ERROR!,"""bridges the gap between knowledge and practice in education""","disseminating information and workshops about the ""7 essential life skills of every child"", based on a book by Ellen Galinksy",,National,
Mindful Ecotherapy Center ,https://mindfulecotherapy.org/,"S2 - Comparison,S3 - Coping",,,,Professional Org,,In-Person Service,,"Education,Health & Wellness",#NAME?,"The Mindful Ecotherapy Center offers online continuing education in ecotherapy and mindfulness. Charlton Hall, MMFT, LMFT/S, RPT-S, CHt is a board-approved provider of continuing education in South Carolina for LPCs and MFTs","Professional counselors and therapists have found these skills to be a welcomed asset to their practices, and participants who have attended the program have reported increased self-esteem, self-awareness, and self-efficacy. Participants also report increased coping skills for depression, anxiety, and trauma.",,national,
The Earthbody Institute,https://www.theearthbodyinstitute.com/,"S2 - Comparison,S3 - Coping",,,,Corporation,,"In-Person Service,Web Service",,Health & Wellness,#ERROR!,"The Earthbody Institute is a professional, educational, and transformational forum dedicated to the cultivation of dynamic mutual relationships with the natural world, for the benefit of greater balance, health and awareness of individuals and groups.","The Earthbody Institute offers affordable, comprehensive and practical Ecotherapy training that empower mental health and other professionals to incorporate the principles and skills of Ecotherapy directly into their work.",,national,
United Way Worldwide,https://www.unitedway.org/our-impact/focus/education/out-of-school-time/featured-topics/specialpopulations,"S1 - Confusion,S2 - Comparison",,,,Non-Profit,,"In-Person Service,Media,Advocacy","mobilizes community power; connects donors to local programs; access to policymakers and local, small leaders of nonprofits in low socioeconomic communities","Advocacy,Disability & Inclusion","***Could fall under many categories!
Advocacy + Disability & Inclusion - Jen",supports other nonprofits that run programs and helps them streamline their work within the local community ,"mobilizes community power; connects donors to local programs; ""improves lives by mobilizing the caring power of communities around the world to advance the common good.""",,International,
KIT - Kids Included Together,https://www.kit.org/,"S1 - Confusion,S4 - Acceptance",,,,Non-Profit,,"Content,Advocacy,In-Person Service,Web Service",like understood. Impressive partnerships: Department of Defense; 21st Century Learning Centers; Afterschool alliance.,"Education,Disability & Inclusion","'- Education
    - Inclusion (equity??)
- Disability & Inclusion","on-site & online training, coaching and consulting, speaking engagements all about inclusion",supporting inclusive practices in organizations and schools,,International,30 people
Growing Up NYC ,https://growingupnyc.cityofnewyork.us/,"S1 - Confusion,S2 - Comparison,S3 - Coping,S4 - Acceptance",,,,Government,,"Content,Advocacy",,Health & Wellness,#ERROR!,"NYC's public programs, can filter by type of program and age. types include difficulties of growing up like mental health but links are not very useful
",Find programs that the NYC government provides ,,New York City families,
Alliance for Quality Education,https://www.aqeny.org/,"S3 - Coping,S4 - Acceptance",,,,Non-Profit,,"Content,In-Person Service",,Education,#NAME?,"The Alliance for Quality Education is a coalition mobilizing communities across the state to keep New York true to its promise of ensuring a high quality public education to all students regardless of zip code. AQE is working to end the systemic racism and economic oppression in New York’s public schools that continues to shortchange generations of Black, Brown, low-income and immigrant students. Combining its legislative and policy expertise with grassroots organizing, AQE advances proven-to-work strategies that lead to student success and ultimately create a powerful public demand for a high quality education.","We believe education justice means that children have the right to high quality academic opportunities, social and emotional supports, full access to arts, music, physical education, and after-school enrichment programs like sports and other extracurricular activities.",,New York state,
Big Thought,https://www.bigthought.org/,S4 - Acceptance,,,,Non-Profit,,"In-Person Service,Content","leader in arts education, after school programming, summer learning, juvenile justice, learning systems and social and emotional learning in Dallas","Education,SED",#ERROR!,"leader in arts education, after school programming, summer learning, juvenile justice, learning systems and social and emotional learning","changing the environment for young people to learn. designs and delivers programs as partners with many different entities
",,National / Texas,
CREATES under the Expanded Success Initiative,https://esinyc.com/creates/,"S1 - Confusion,S2 - Comparison",,,,Government,,In-Person Service,partnerships with Universities to coach schools on CRE,Education,#ERROR!,organization that works with NYC schools about implementing CRE practices through coaches and academic advisors,"to work with schools to develop culture, youth development and academics. Coaches are partnered with NYC Universities",,New York City,
"CASEL - Collaborative for Academic, Social, and Emotional Learning",https://casel.org/what-is-sel/,"S3 - Coping,S4 - Acceptance",,,,Non-Profit,,"Product,Content",SEL curriculum; a big too big for its britches at this point,"Education,SED",#ERROR!,standards are utilized by many international organizations. Written about in the UNICEF and UN initiatives  ,"to help various sizes of education systems apply SEL. nations, state, districts, nonprofits worldwide ",,,50-100
National Association for Holistic Aromatherapy.,https://naha.org/,S3 - Coping,,,,Professional Org,,"In-Person Service,Content",,Health & Wellness,#NAME?,"The National Association for Holistic Aromatherapy is a 501(c)3 member based non-profit association devoted to the holistic integration and education of aromatherapy into a wide range of complementary healthcare practices including self care and home pharmacy. We offer scientific, empirical and current information about aromatherapy and essential oils to the public, practitioners, businesses, product designers, bloggers/writers, educators, healthcare professionals, and the media.",NAHA's mission is to advance the knowledge of the medicinal use of aromatic plants and essential oils to its fullest extent and to support aromatherapy as a truly holistic professional art and science.,,National,
*In:CITE,https://incitejournal.org/index.php/incite/about,S4 - Acceptance,,,,Other,,"Content,Advocacy",online magazine by young people with disabilities,Disability & Inclusion,#ERROR!,Youth-led journal that features the voices of people from all different identities and outwardly objects ableism,"""in:cite is an online space and community for gathering and spreading knowledge by, for, and created with young people. We are guided by critical race, decolonial, feminist, queer, disability justice, and intersectional approaches, and seek to dismantle systems of oppression such as white supremacy, capitalism, colonialism, heteropatriarchy, and ableism.""",,,
EU Disability Forum,http://www.edf-feph.org/,"S4 - Acceptance,S1 - Confusion",,,,Non-Profit,,"Content,Advocacy",collective that holds conference about policy for people with disabilities with EU countries. Nonprofits are members,Disability & Inclusion,#NAME?,"large organization by the EU that associate members, who are nonprofits and organizations devoted to disability right, can join ","persons with disabilities in Europe are fully included in society on an equal basis with others and that our human rights, as outlined in the UN Convention on the Rights of Persons with Disabilities",,,
*Franklin School of Integrative Health Sciences,https://fsihs.org/,"S1 - Confusion,S2 - Comparison,S3 - Coping",,,,Other,,"Content,In-Person Service,Web Service",,Health & Wellness,#NAME?,"The Franklin School of Integrative Health Sciences was established in 2013 by Dr. Jessie Hawkins to raise the bar in integrative health education. FSIHS was originally authorized as a formal college in late 2013 and provided primary holistic health education and training until early 2020. Today, FSIHS prioritizes continuing professional education in evidence based holistic health and clinical research on holistic, preventive, and public health.",Our mission at the Franklin School of Integrative Health Sciences is to empower health professionals to distinguish between the science and pseudoscience of holistic health.,,national,
Disability Visibility Project,https://disabilityvisibilityproject.com/,"S1 - Confusion,S2 - Comparison,S3 - Coping,S4 - Acceptance",,,,Corporation,,"Advocacy,Media",influencers in the advocacy groups of individuals who identify with disability but are not defined by it,Disability & Inclusion,#NAME?,"led by Alice Wong, displayed and publishes first-person stories about people with disabilities, especially how they came to know they are ""different""","imagined, created, published, and sustained by people who identify as disabled",,National,
Museum of Modern Art,https://www.moma.org/support/corporate/sponsorship,"S1 - Confusion,S3 - Coping,S4 - Acceptance",,,,Non-Profit,,"In-Person Service,Media,Product",journey of finding oneself; how this connects to disability,"Education,Institution",#NAME?,private museum dedicated to artists that represent the development of human growth ,"mission to celebrate tolerance, diversity, openness",,international,
Nutritional Therapy Association ,https://nutritionaltherapy.com/,S3 - Coping,,,,Professional Org,,"Content,In-Person Service,Web Service",,Health & Wellness,#NAME?,The Nutritional Therapy Association is a nutrition school for those seeking a foundational and holistic approach for assessing nutritional deficiencies in the body. Our curriculum is evidence-based and backed by science while honoring bio-individuality and the body’s natural capacity to heal. ,"To deliver a science-based education that fosters a community of confident holistic nutrition professionals who harness the power of real food and empower people to reconnect with the innate wisdom and unique needs of their bodies, thereby supporting lasting wellness.",,Global,
Association for Play Therapy,https://www.a4pt.org/,"S2 - Comparison,S3 - Coping",,,,Professional Org,,"Content,In-Person Service,Web Service",,Health & Wellness,#ERROR!,"The Association for Play Therapy (APT) is a national professional society established in 1982 to foster contact among mental health professionals interested in exploring and, when developmentally appropriate, applying the therapeutic power of play to communicate with and treat clients, particularly children.","Promote the value of play, play therapy, and credentialed play therapists and advance the psychosocial development and mental health of all people through play and play therapy by supporting those programs, services, and related activities that promote organizational growth, public awareness, research, and diversity in the field of play therapy.",,national,
Create Ability [A MOMA Access Program],https://www.moma.org/calendar/programs/34,S4 - Acceptance,,,,Non-Profit,,"In-Person Service,Content",program to increase accessibility of MOMA visitors; runs workshops,"Disability & Inclusion,Accessibility",(PG- Added Accessibility as this fall under MoMA's Access Programs area),program for individuals who identify with intellectual and developmental disabilities and their families. ,"Each month participants focus on a different theme, exploring various artworks in the galleries and creating artworks in the classroom.",,international,
Inclusive Mobility by the Volkswagen Group of America,https://www.inclusivemobility.com/,S4 - Acceptance,,,,Other,,"Product,In-Person Service",,Disability & Inclusion,#NAME?,"1 in 5 people in the US have disabilities, committed to increasing mobility for these people","create ""mobility"" solutions and donate to specific organizations dedicated to opening accessibility for people with disabilties",,National,
American Therapeutic Recreation Association,https://www.atra-online.com/?,"S2 - Comparison,S3 - Coping",,,,Professional Org,,"Content,In-Person Service,Web Service",,Health & Wellness,#NAME?,"The American Therapeutic Recreation Association (ATRA) is the only national membership organization representing the interests and needs of therapeutic recreation specialists, also known as recreational therapists. Recreational therapists are healthcare providers who plan, direct, deliver, and evaluate recreation-based interventions for individuals with illnesses and/or disabling conditions. They provide research-informed interventions that are based on client assessments and targeted client outcomes.",We envision a world where all people have access to Recreational Therapy.,,National,
The Society for Community Research and Action,https://www.communitypsychology.com/,"S2 - Comparison,S3 - Coping",,,,Professional Org,,"Content,In-Person Service,Web Service",,Health & Wellness,#ERROR!,"Society for Community Research and Action (SCRA) - Community Psychology, Division 27 of the American Psychological Association - serves many different disciplines that focus on community research and action. Our members are committed to promoting health and empowerment and to preventing problems in communities, groups, and individuals.","The Society for Community Research and Action is an organization devoted to advancing theory, research, and social action. Its members are committed to promoting health and empowerment and to preventing problems in communities, groups, and individuals. SCRA serves many different disciplines that focus on community research and action.",,Global,
