Glassdoor,https://www.glassdoor.com,,,"S2 - Comparison,S3 - Matching,S4 - Employment",,Corporation,,"Content,Web Service",,"Employment,Mentorship",,"Glassdoor is one of the world’s largest job and recruiting sites. Built on the foundation of increasing workplace transparency, Glassdoor offers millions of the latest job listings, combined with a growing database of company reviews, CEO approval ratings, salary reports, interview reviews and questions, benefits reviews, office photos and more. ",To help people everywhere find a job and company they love.,,International,
Apprenticeship Finder,https://www.apprenticeship.gov/apprenticeship-finder,,,"S3 - Matching,S4 - Employment",,Government,,Web Service,,"Employment,Skill-building",,"A subset of the Department of Labor (whose mission is written to the right), apprenticeship finder looks to help people start their career and build a skill set through an apprenticeship. ","To foster, promote, and develop the welfare of the wage earners, job seekers, and retirees of the United States; improve working conditions; advance opportunities for profitable employment; and assure work-related benefits and rights.",,National,
Handshake,https://joinhandshake.com/,,,"S3 - Matching,S4 - Employment",,Corporation,,"Web Service,Content",,Employment,,"Handshake partners with colleges to create a platform that gives students easy access to job opportunities. Similar to LinkedIn's jobs feature, it creates a ""career community"" that displays a multitude of job opportunities to students based on their interests. Over 500k employers are involved on the other end.","To give all students the chance to build the career they want, no matter where they’re from or what school they attend.",,Global,
Zip Recruiter,https://www.ziprecruiter.com/candidate/suggested-jobs,,,"S4 - Employment,S2 - Comparison",,Corporation,,Web Service,,Employment,,Helping youth by providing education and skill development for future employment opportunities. Ziprecruiter helps to match people with jobs.,We’re committed to helping all people have equal opportunity to find employment and further their careers,,International,
Idealist,https://www.idealist.org,,,S4 - Employment,,Non-Profit,Also known as Action without Borders,Web Service,,Employment,,"Idealist, similarly to places like Zip Recruiter, posts hundreds of thousands of job, internship, and volunteer opportunities on their website that people can easily apply to.","Working with others, in a spirit of generosity and mutual respect, we want to help build a world where all people can lead free and dignified lives. ",,global,
Cleverism,https://www.cleverism.com/,,,"S3 - Matching,S4 - Employment",,Corporation,,"Web Service,Content",,"Employment,Skill-building",,"Help people get on a good track to find their dream job. Provides people with courses and resources to become better equipped to go into the work world (i.e. networking skills, resume building, etc), resume building tools, and a jobboard with millions of jobs posted.",Want to help career enthusiasts with a learning mindset to get what they deserve: Their Dream Job,,Global,
Art Jobs,https://www.artjobs.com/#,,,"S3 - Matching,S4 - Employment,S2 - Comparison",,Corporation,"I think for-profit due to pricing aspect (Jen)
PG- Agreed on for profit",Media,Community for artists and creative minds,Employment,,"They post jobs and provide industry advice relating to various art subfields, such as visual arts, photography, publishing, design, fine art, dance & performance, education, video & film, public art, literacy, crafts and fashion",To help young artists find employment opportunities and grow their own businesses.  ,,National,
American Institute for Graphic Arts,https://www.aiga.org/,,,"S2 - Comparison,S3 - Matching,S4 - Employment",,Professional Org,,"Web Service,Media","Provide training, advice and advocate for student art groups at colleges","Advocacy,Employment",,"The American Institute of Graphic Arts (AIGA) is a professional organization for design. Its members practice all forms of communication design, including graphic design, typography, interaction design, branding and identity.",To provide young artists and creative minds the education and resources to find employment. ,,National,
The Art Career Project,https://www.theartcareerproject.com/careers/,,,"S3 - Matching,S4 - Employment",,Corporation,,"Content,Funding",provide scholarships for beginning art students,"Employment,Advocacy",,"The Art Career Project connects artists to career development in the industry, either jobs or schools. ",To help artists be successful in life,,,
The Tent Partnership for Refugees,https://www.tent.org/,,,"S3 - Matching,S4 - Employment",,Non-Profit,,"Product,Web Service",The org partner's refugees with organization and provide training to integrate them into the workforce,"Employment,Equity and Social Justice",,Job related resources for refugees,"The Tent Partnership for Refugees is a non-profit organization launched in 2016 to mobilize the global business community to include refugees. Today, we are a network of over 100 major companies committed to integrating refugees in their host communities.",,,
Bender Consulting Services Inc. ,https://www.benderconsult.com/about-us,,,"S3 - Matching,S4 - Employment",,Corporation,Social organization,"In-Person Service,Web Service,Product","a database of over 27,000 candidates with disabilities seeking professional career opportunities and a network of thousands of disability and academic institution partners","Disability & Inclusion,Employment",,Bender has delivered top talent and disability inclusion solutions to Fortune 500 corporations and federal government employers.,"Bender provides disability employment expertise in the areas of recruitment, workplace mentoring, strategic planning, training, and digital accessibility to drive innovation and realize business value for customers.
Bender provides disability employment expertise in the areas of recruitment, workplace mentoring, strategic planning, training, and digital accessibility to drive innovation and realize business value for customers.",,National,
Set To Go - A Jed Program,https://www.settogo.org/finding-balance/,,,"S3 - Matching,S4 - Employment",,Non-Profit,,"Content,Product,Web Service",The program helps students with their transition.,"Skill-building,Independent Living,Education",,Emotional preparedness for life after high school ,Set to Go is a program from The Jed Foundation (JED) built to help teens prepare for the transition out of high school.,,,
National Sports Marketing Network,https://sportsmarketingnetwork.com/about.shtml,,,"S3 - Matching,S4 - Employment",,Professional Org,,In-Person Service,,"Education,Employment",,National Sports Marketing Network (NSMN) is the trade organization for the sports business industry in the United States.,"The national organization is dedicated to the advancement of the sports business industry through networking and the production of thought-provoking, issue-oriented seminars created to raise the level of discourse on critical sports industry issues.",,National,
BOCES,https://www.boces.org/,,,"S3 - Matching,S4 - Employment",,Government,,In-Person Service,"On average, 96%
of seniors enrolled in
BOCES career and
technical education
programs graduate. 20,751 adult students improved their job prospects by enrolling in BOCES workforce development courses.","Education,Skill-building",,Today there are 37 BOCES that are partnering with nearly all of the state’s school districts to help meet students’ evolving educational needs through cost-effective and relevant programs.,,,New York State but does not include the 5 boroughs of NYC,
San Diego Workforce Partnership,https://workforce.org/,,,"S3 - Matching,S4 - Employment",,Non-Profit,,"In-Person Service,Content,Advocacy",,"Employment,Mentorship",,,,,,
Maine Transition Collaborative,https://www.maine-ytc.org/community-engagement/york-county-foster-care-collaborative/post-secondary-education-supports/,,,"S3 - Matching,S4 - Employment",,Non-Profit,,"In-Person Service,Content,Advocacy",,"Employment,Equity and Social Justice",,The Maine Youth Transition Collaborative (MYTC) is a partnership of public and private sector partners who work together at the state and local levels to provide more opportunities and improve outcomes for youth in transition from foster care,,,,
Americorps,https://www.nationalservice.gov/programs/americorps,,,"S3 - Matching,S4 - Employment",,Government,,In-Person Service,more than 180 colleges and universities across the country actively recruit AmeriCorps alumni by offering scholarships or matching tuition funding for AmeriCorps alums. (only need GED or HS degree to do Americorps),"Employment,Community Service",,,,,,
Youth Build,https://www.youthbuild.org/,,,"S3 - Matching,S4 - Employment",,Non-Profit,,"In-Person Service,Advocacy",internships/programs for technical skills; Americorps funds community service trips for HS students; many partnerships with local nonprofits,"Equity and Social Justice,Advocacy",,"YouthBuild programs provide those pathways. All over the world they unleash the positive energy of low-income young people to rebuild their communities and their lives, breaking the cycle of poverty with a commitment to work, education, family, and community. ","YouthBuild USA provides training and technical assistance, leadership development, funding for innovative program enhancements, and advocacy for these programs.
",,National and International,
Opportunity Youth United,https://oyunited.org/about-us/,,,"S3 - Matching,S4 - Employment",,Non-Profit,,"In-Person Service,Advocacy",disperses funds to community projects that a led by youth leaders who are elected by local non-profited,"Equity and Social Justice,Community Service",,"Our vision is a society with opportunity and responsibility, love and respect, education and employment, justice and equality for all. We envision a nation where all young people can reach their highest potential and noblest aspirations in the context of safe, supportive, and healthy communities.","is a national movement of young leaders who have decided to join forces to increase opportunity and decrease poverty in America. We are a group as diverse as America. Our members are Black, White, Native American, Latinx, Asian, and Mixed Heritage with different religions, ethnicities, genders and sexual identities representing urban, rural, and tribal communities.",,National ,6 Employees
Get Schooled - Job Launch,https://getschooled.com/job-search/,,,"S3 - Matching,S4 - Employment",,Non-Profit,,"Content,Media,Web Service",1-1 text; friendly website; huge funders; 1:1 support help young people apply to jobs and achieve early job success.,"Education,Employment",,,,,,
Lime Connect,https://www.limeconnect.com/,,,"S3 - Matching,S4 - Employment",,Non-Profit,,"In-Person Service,Media,Advocacy",,"Disability & Inclusion,Employment",,"rebranding disability through achievement.  We do that by attracting, preparing, and connecting high potential university students and professionals to careers, scholarships and internships. ","We are breaking stereotypes and leading companies of every size, industry and location to understand the importance of, and fully value, the talent and strengths that employees with disabilities bring to the workplace.",,United States and Canada,
Rotary Club,https://www.rotary.org/en,,,"S2 - Comparison,S3 - Matching,S4 - Employment",,Non-Profit,,"In-Person Service,Media,Advocacy,Funding","millions of members; 35,00 clubs around the country; scholarships & volunteer opportunities","Equity and Social Justice,Community Service",,,,,,
Lifehack,The,,,"S2 - Comparison,S1 - Dependency,S3 - Matching,S4 - Employment",,Corporation," could be For-profit? Courses cost money; does not explicit say ""non-profit""
- ""Crunchbase"" lists it as ""For-profit","Web Service,Content","talks about ""fixed ability""",Employment,,"Provides courses and content to help people better themselves and learn more about gaining skills, navigating the workforce, and surviving life.",Helping people change their lives to live happily.,,,
What You Can Do: The Campaign for Disability Employment,https://www.whatcanyoudocampaign.org/,,,S2 - Comparison,,Government,"Government, US Department of Labor",Advocacy,,"Employment,Disability & Inclusion",,"Making sure the world knows that ""Every day, people with disabilities can and do make important contributions to America’s businesses. They have the drive to succeed in employment, and the skills and talent they need to deliver value and results for their employers.""",To help shape attitudes about the employment of people with disabilities and foster dialogue around an issue of vital importance to all workers.,,International,
The National Pan-Hellenic Council (NPHC),https://nphchq.com/millennium1/,,,"S2 - Comparison,S3 - Matching","S2 - Comparison,S3 - Pathing,S4 - Resilience",Non-Profit,501c3,"In-Person Service,Funding,Advocacy",There are opportunities for BLGO undergrads to take on leadership roles and network for jobs. ,"Education,Mentorship",,"The National Pan-Hellenic Council (NPHC) is a collaborative council composed of historically African American Greek-lettered fraternities and sororities. The nine NPHC organizations are sometimes collectively referred to as the ""Divine Nine (D9)"".","The purpose of the NPHC shall be to foster cooperative actions of its members in dealing with matters of mutual concern. To this end, the NPHC promotes the well-being of its affiliate fraternities and sororities, facilitates the establishment and development of local councils of the NPHC and provides leadership training for its constituents.",,International,More than 2.5 million members internationally
"Congressional Black Caucus Foundation, Inc.",https://www.cbcfinc.org/,,,"S2 - Comparison,S4 - Employment",,Non-Profit,,"Content,In-Person Service,Web Service,Advocacy,Media",Have many fellowships for undergrads and post-grads,"Equity and Social Justice,Education",,"The Congressional Black Caucus Foundation is an American educational foundation. It conducts research on issues affecting African Americans, publishes a yearly report on key legislation, and sponsors issue forums, leadership seminars and scholarships. ","Our mission of the Congressional Black Caucus Foundation, Inc. (CBCF) is to advance the global black community by developing leaders, informing policy, and educating the public.",,National,
Celebrating Disability,https://celebratingdisability.co.uk/,,,"S3 - Matching,S2 - Comparison,S4 - Employment",,Other,"*not sure, also in the UK mostly
- good ""other""",Web Service,,"Employment,Disability & Inclusion",,Celebrating Disability is a disability inclusion business supporting disability awareness in the workplace.  We support organisations to feel confident and competent about engaging and interacting with disabled people as employees and customers.,"To ensure that businesses and not-for-profits are equipped with tools; the what, the why and the how that is necessary to achieve disability inclusion and equality in the workplace",,International; UK,
Disability:IN,https://disabilityin.org/,,,"S3 - Matching,S2 - Comparison,S4 - Employment",,Non-Profit,,Web Service,,"Disability & Inclusion,Employment",,Disability:IN is the leading nonprofit resource for business disability inclusion worldwide. Our network of over 220 corporations expands opportunities for people with disabilities across enterprises. Our central office and 27 Affiliates serve as the collective voice to effect change for people with disabilities in business.,"To collaborate with purpose to promote the full inclusion of people with disabilities, to inspire accessible innovation for all, and to foster cultures of inclusion.",,International,
Divas with Disabilities,https://www.divaswithdisabilities.org/learn-about-dwd.html,,,"S1 - Dependency,S2 - Comparison",,Non-Profit,,Media,,"Disability & Inclusion,Advocacy",advocacy of women with disability towards media and the arts,"Network supporting Black and Brown women and girls with physical disabilities by ensuring our identities are fostered in inclusive sources of mass media and popular culture, and our images are not erased from American history.",To reshape what disability looks like by promoting Black and Brown women and girls with physical disabilities through various media platforms.,,National,
Freedom University,https://freedom-university.org/mission,,,"S1 - Dependency,S3 - Matching,S4 - Employment",,Non-Profit,Freedom University is organized as an independent non-profit organization under the 501(c)3 fiscal sponsorship of The Praxis Project,"Content,Media,In-Person Service,Web Service",,"Equity and Social Justice,Education",,"Freedom University is a modern-day freedom school based in Atlanta. We provide tuition-free and rigorous college preparation classes, college and scholarship application assistance, and social movement leadership development for undocumented students in Georgia. ",Our mission is to empower undocumented youth and fulfill their human right to education.,,National,
American Association for People with Disabilities,https://www.aapd.com/,,,"S1 - Dependency,S3 - Matching,S4 - Employment",,Non-Profit,,"Web Service,Content,Advocacy",,"Disability & Inclusion,Advocacy",,AAPD’s initiatives aim to increase the political and economic power of people with disabilities.,"As a convener, connector and catalyst, AAPD supports 60 million Americans with disabilities.",,National,<20
Galt Foundation,https://www.galtfoundation.org/about,,,"S3 - Matching,S4 - Employment",,Non-Profit,services to find employment for people with disabilities,"Web Service,Advocacy",coaches employees & employers on how to hire people with disabilities,"Disability & Inclusion,Employment",,"We work with employees one-on-one to understand their unique skills, capabilities, and needs – and continue to support them with mentoring and coaching. With our experience and expertise, we know how to find the types of jobs and working environments where our employees can add value and thrive.",,,National; emphasis on North West region of the US,
Betterhelp,https://www.betterhelp.com/,,,,S3 - Pathing,Corporation,Owned by Teladoc Inc,Web Service,Providing service through phone communication mainly,Health & Wellness,,"Helping people with different aspects of their life with behavioral help services through the web, phone, or text communication.","Making professional counseling accessible, affordable, convenient - so anyone who struggles with life’s challenges can get help, anytime, anywhere.",,Nation,
Therapy for Black Girls,https://therapyforblackgirls.com/,,,,"S1 - Hopelessness,S2 - Comparison,S4 - Resilience","Professional Org,Corporation",Unclear status- offers memberships so may be a profesional org for therapists serving this population,"In-Person Service,Product,Web Service,Media",,"Equity and Social Justice,Health & Wellness",,The organization pairs individuals with therapists in based off their location. There's also an in-office and virtual option as well as podcasts and blogs.,An online space where mental health topics feels accessible and relevant for Black women and girls. Interested in de-stigmatizing mental health.,,National,
LinkedIn,https://www.linkedin.com/home,,,,"S4 - Resilience,S3 - Pathing,S2 - Comparison",Corporation,,"Media,Web Service",,Employment,,"LinkedIn is the largest professional network on the internet. LinkedIn can be used to find the right job, internships and connections. ",The mission of LinkedIn is simple: connect the world’s professionals to make them more productive and successful.,,National and International	,"16,000"
Daily Yoga,https://www.dailyyoga.com/,,,,S4 - Resilience,Corporation,,"Web Service,Product",,Health & Wellness,,Easy to use ,Focused on providing intuitive and comprehensive yoga training app for everyone. ,,National	,
Hoopla,https://www.hoopladigital.com/,,,,"S4 - Resilience,S3 - Pathing",Corporation,It is the digital service of Midwest Tape LLC,"Content,Web Service",,"Education,Technology",,"The platform allows you to borrow movies, music, audiobooks, ebooks, comics, and TV shows with your library card.",Empower libraries through the delivery of more engaging patron experiences; a dynamic mission that is ever-changing.,,National,
MasterClass,https://www.masterclass.com/,,,,"S1 - Hopelessness,S2 - Comparison,S3 - Pathing,S4 - Resilience",Corporation,,Web Service,,"Education,Skill-building",,MasterClass is the streaming platform that makes it possible for anyone to watch or listen to hundreds of video lessons taught by 85+ of the world’s best,MasterClass is an immersive online experience that offers access to genius by allowing anyone to take online classes,,International,
LinkedIn Learning,https://learning.linkedin.com/product-overview,,,,"S3 - Pathing,S4 - Resilience",Corporation,,Web Service,,"Education,Skill-building",,"Strengthen skills and drive engagement through a learning experience that is personalized and social. Topics include, business, technology, creative (i.e. photography) and certification programs","LinkedIn Learning is an online educational platform that helps you discover and develop business, technology-related, and creative skills through expert-led course videos",,International,
Udemy,https://www.udemy.com/,,,,"S3 - Pathing,S4 - Resilience",Corporation,,Web Service,,"Skill-building,Employment,Independent Living",,Students and professional take courses to improve job-related skills ,"Online learning platform aimed at professional adults and students 
",,International,
Coursera,https://www.coursera.org/,,,,"S3 - Pathing,S4 - Resilience",Corporation,,Web Service,,"Skill-building,Employment,Independent Living",,Learn new skills and earn a certificate ,"""We envision a world where anyone, anywhere can transform their life by accessing the world's best learning experience""",,International,
Skill Share,https://www.skillshare.com/,,,,"S3 - Pathing,S4 - Resilience",Corporation,,"Product,Web Service",,"Skill-building,Employment",,"Skill Share is focused on exploring creativity and deepening existing passion. The courses are organized into design, fashion and style, music, photography etc.","To inspire and multiply the kind of creative exploration that furthers expression, learning and application.",,National,
Inspire,https://corp.inspire.com/,,,,"S1 - Hopelessness,S2 - Comparison,S4 - Resilience",Corporation,Social networking service,Media,It is an online community,"Health & Wellness,Mentorship",,Inspire has created a vibrant community of support groups with the most trusted partners. ,"People feel safe and are able to be authentic, share and explore feelings and learn about their medical journey from people who have “been there.” ",,,
Our Odyssey,https://ourodyssey.org/,,,,"S1 - Hopelessness,S2 - Comparison",Non-Profit,,Media,It is an online community,"Health & Wellness,Advocacy",,Empowering young adults impacted by chronic & rare conditions,"Connecting young adults impacted by a rare or chronic condition with social and emotional support in the hope of improving their quality of life. 
To grow into a nationally recognized organization which will address all of the challenges that young adults with rare and chronic conditions face, to furnish a platform for connection, and supply the resources to enable them to thrive.",,National,
Noom,https://www.noom.com/#/,,,,S3 - Pathing,Corporation,,Product,,"Health & Wellness,Technology",,"We work with customers across the globe to help them create healthier habits, reduce their risk of chronic health problems, reverse disease, and foster healthier relationships with themselves in the process through a cognitive behavioral approach.",Help people lead healthier lives through behavior change. ,,National,
Franklin Covey,https://www.franklincovey.com/the-7-habits.html,,,,"S3 - Pathing,S4 - Resilience",Corporation,,"In-Person Service,Content",,Health & Wellness,"long-term personal and career goals, habits and workstreams","Based on the book ""7 Traits of Highly Effective People"" by Steven Covey, its a consultancy that consults companies on creating workplaces that address unconscious bias, disciplines of execution, trust","helping organizations achieve results that require lasting changes in human behavior and work culture through coaches, webinars, whole-culture revision",,International,
The Happiness Project,https://gretchenrubin.com/about/biography/#newsletter,,,,"S3 - Pathing,S4 - Resilience",Other,"Would this be a record we tag as something else since it is a book?

A book written by Gretchen Rubin",Media,,Health & Wellness,,workshops and seminars about building on one's own strengths and goals,changing habits for a more content life,,National,
The Skoll Foundation,https://skoll.org/about/,,,,S4 - Resilience,Foundation,,Funding,,"Entrepreneurship,Equity and Social Justice",,"The Skoll Foundation drives large-scale change by investing in, connecting, and celebrating social entrepreneurs and the innovators who help them solve the world’s most pressing problems.
",We identify people and organizations with innovations creating scalable positive impact. ,,International,
2U,https://2u.com/,,,,"S3 - Pathing,S4 - Resilience",Corporation,,,,"Education,Technology",,Partners with Universities around the world to provide online learning,Brings the university into the home space of people; expand opportunities for learners,,International,
Microsoft - Inclusive Methodologies,https://www.microsoft.com/design/inclusive/,,,,"S3 - Pathing,S4 - Resilience","Corporation,Other",If this is an initiative like Google AI should we figure out how to tag it separately?,,,"Technology,Accessibility",,Partnerships about inclusive designs that embody accessibility,drive projects that are about creating more inclusive technologies,,,
